[
  {
    "type": "chime_report",
    "description": "test",
    "enabled": true,
    "number_to_display": 1,
    "filters": {
      "folder_id": "12345678-1234-1234-1234-123456789012",
      "statuses": [
        "Assigned",
        "Work In Progress"
      ]
    },
    "name": "testa",
    "notification": {
      "type": "chime_webhook",
      "webhook_url": "https://hooks.chime.aws/incomingwebhooks/12345678-1234-1234-1234-123456789012?token=123456789012345678901234567890123456789012345678901234567890123456789012"
    },
    "id": "abcde12345abcde12345abcde1234532"
  },
  {
    "type": "email_report",
    "description": "test",
    "enabled": true,
    "number_to_display": 100,
    "oncall": "prod",
    "filters": {
      "folder_id": "12345678-1234-1234-1234-123456789012",
      "statuses": [
        "Assigned"
      ]
    },
    "name": "testa",
    "notification": {
      "type": "email",
      "address": "test@example.com"
    },
    "id": "abcde12345abcde12345abcde1234532"
  }
]
